Title,Notes,URL
How Notion Scaled to 100 Million Users Without Their Database Exploding ,"Doubling down on Postgres, scaling horizontally using shards and pgbouncer",https://www.youtube.com/watch?v=HruBoinmPBA
Brendan Gregg: The Speed of Time,Flamegraphs discovers reading current time took longer on Ubuntu than CentOS,https://www.brendangregg.com/blog/2021-09-26/the-speed-of-time.html
How Instagram Reduced Web Page Load by 50% ,"Many optimization patterns for front-end, from HTTP transportation, to asset fetching order, to caching locally (and avoiding conflicts with new state updates)",https://www.youtube.com/watch?v=ahyk7h7qAF4
How Instagram Scaled to 14 Million Users With Only 3 Engineers ,"Postgres: pgbouncer, ID strategy for finding correct shard, (stateless) Django, Gearman, etc.",https://www.youtube.com/watch?v=TdhXPsDXdAI
Unix and Google,"'Coding at the perimiter', an approach to tackle the n^3 matrix of system ✕ feature ✕ platform. Examplifies with Multics vs UNIX",https://www.youtube.com/watch?v=3Ea3pkTCYx4
